{
  "schema_version": "aha_import_payload_v1",
  "contract_version": 1,
  "source": "historygo",
  "exported_at": "2026-08-13T10:00:00.000Z",
  "hg_knowledge_entries_v2": [
    {
      "id": "knowledge-1",
      "subject_id": "historie",
      "topic": "Kildekritikk",
      "text": "Kilder må vurderes i sin historiske sammenheng."
    }
  ],
  "hg_learning_log_v1": [],
  "hg_insights_events_v1": [],
  "notes": [],
  "dialogs": [],
  "privacy": {
    "scope": "private_user",
    "public_sharing": false,
    "model_training_allowed": false
  }
}
